[
  {
    "id": "water",
    "number": "H1",
    "name": "Water & Power",
    "claim": "Where compute meets the watershed.",
    "thesis": "The original thesis: hyperscale compute lands where it can pull power and water, and a data center's intake, discharge, and downstream effects are basin facts. Sites nest by drainage — two divides, nine basins. Lima is the live, fully-assembled reference.",
    "status": "reference",
    "signals": [
      "anchor",
      "strong",
      "moderate",
      "watch"
    ],
    "groups": [],
    "fields": [],
    "related_docs": [
      "docs/HYDROLOGY.md",
      "docs/COURSE.md"
    ],
    "predicted_evidence": [
      "cooling consumptive draw measured against the receiving water's cited 7Q10",
      "an NPDES discharge to an already effluent-dominated stream",
      "a paved campus footprint's pre/post-development stormwater delta",
      "a serving utility / PJM zone that makes the load economically siteable"
    ]
  },
  {
    "id": "defense",
    "number": "H2",
    "name": "Defense & Federal Enclave",
    "claim": "Where the build-out meets federal land and the defense base.",
    "thesis": "A second reading: the same map tracks arsenals, air bases, federal research and the CHIPS build — enclaves where federal jurisdiction, clearance, and defense supply chains concentrate. Newly opened; most sites are not yet assessed, and a federal nexus is a signal, not a verdict.",
    "status": "emerging",
    "signals": [
      "anchor",
      "strong",
      "moderate",
      "watch"
    ],
    "groups": [
      "arsenal",
      "federal",
      "supply",
      "watch"
    ],
    "fields": [
      "nexus",
      "linkage"
    ],
    "related_docs": [
      "docs/defense-nexus.md"
    ],
    "predicted_evidence": [
      "a co-located or adjacent arsenal, air base, or federal research lab",
      "a CHIPS / federal semiconductor or defense-supply designation",
      "a documented authorization posture (FedRAMP / DoD IL clearance level)"
    ]
  },
  {
    "id": "surveillance",
    "number": "H3",
    "name": "Corporate & Economic Surveillance",
    "claim": "Who owns it, who's watching, and where the money moves.",
    "thesis": "A third reading: the operators behind shell LLCs, the public-subsidy stack that pulls them in, and the capital and data flows the facilities sit on. The corporate-and-economic-surveillance thesis — opening now, mostly under investigation, with Lima's abatement on record.",
    "status": "emerging",
    "signals": [
      "anchor",
      "strong",
      "moderate",
      "watch"
    ],
    "groups": [
      "onrecord",
      "subsidy",
      "watch"
    ],
    "fields": [
      "operator",
      "capital"
    ],
    "related_docs": [
      "docs/ECONOMICS.md"
    ],
    "predicted_evidence": [
      "a named operator behind a shell LLC (deed / SOS / LEI trail)",
      "a public-subsidy instrument on record (CRA / TIF / enterprise-zone abatement)",
      "a capital or data-flow linkage tying the site to a known operator"
    ]
  }
]
